{
  "schema_version": 2,
  "scenario_id": "linux-static-ipv4-v3",
  "description": "Bounded G5 Linux comparison: forwarding, ARP failure policy, route recovery, and checksum rejection with healthy controls. Contract frozen before the experiment.",
  "fixture": "fixtures/scenarios/icmp-static-v1.json",
  "cases": [
    "S01",
    "S02",
    "S03",
    "S04",
    "R01",
    "N01",
    "N02"
  ],
  "expected": {
    "S01": {
      "outcome": "echo_reply",
      "icmp_type": 0,
      "icmp_code": 0,
      "forwarded_ttl": 63
    },
    "S02": {
      "outcome": "unreachable",
      "icmp_type": 3,
      "icmp_code": 0,
      "forwarded_ttl": null
    },
    "S03": {
      "outcome": "time_exceeded",
      "icmp_type": 11,
      "icmp_code": 0,
      "forwarded_ttl": null
    },
    "S04": {
      "outcome": "arp_timeout",
      "icmp_type": 3,
      "icmp_code": 1,
      "forwarded_ttl": null
    },
    "R01": {
      "outcome": "echo_reply",
      "icmp_type": 0,
      "icmp_code": 0,
      "forwarded_ttl": 63
    },
    "N01": {
      "outcome": "invalid_packet",
      "icmp_type": null,
      "icmp_code": null,
      "forwarded_ttl": null
    },
    "N02": {
      "outcome": "invalid_packet",
      "icmp_type": null,
      "icmp_code": null,
      "forwarded_ttl": null
    }
  },
  "comparison_policy": {
    "required": {
      "S01": [
        "fixture_outcome",
        "identical_router_ingress_ipv4",
        "source_receives_expected_icmp",
        "valid_ip_and_icmp_checksums",
        "forwarded_request_or_no_forward",
        "router_ethernet_rewrite",
        "icmp_payload_or_error_quote",
        "capture_no_kernel_drops",
        "lab_preconditions"
      ],
      "S02": [
        "fixture_outcome",
        "identical_router_ingress_ipv4",
        "source_receives_expected_icmp",
        "valid_ip_and_icmp_checksums",
        "forwarded_request_or_no_forward",
        "router_ethernet_rewrite",
        "icmp_payload_or_error_quote",
        "capture_no_kernel_drops",
        "lab_preconditions"
      ],
      "S03": [
        "fixture_outcome",
        "identical_router_ingress_ipv4",
        "source_receives_expected_icmp",
        "valid_ip_and_icmp_checksums",
        "forwarded_request_or_no_forward",
        "router_ethernet_rewrite",
        "icmp_payload_or_error_quote",
        "capture_no_kernel_drops",
        "lab_preconditions"
      ],
      "S04": [
        "fixture_outcome",
        "identical_router_ingress_ipv4",
        "arp_requests_without_reply",
        "arp_failure_result",
        "no_forwarded_request",
        "valid_observed_checksums",
        "capture_no_kernel_drops",
        "lab_preconditions"
      ],
      "R01": [
        "fixture_outcome",
        "identical_router_ingress_ipv4",
        "source_receives_expected_icmp",
        "valid_ip_and_icmp_checksums",
        "forwarded_request_or_no_forward",
        "router_ethernet_rewrite",
        "icmp_payload_or_error_quote",
        "capture_no_kernel_drops",
        "lab_preconditions",
        "route_missing_before_change",
        "route_added_after_failure"
      ],
      "N01": [
        "fixture_outcome",
        "checksum_fault_preserved",
        "invalid_input_silent",
        "valid_control_recovers",
        "quiet_window_bounded",
        "capture_no_kernel_drops",
        "lab_preconditions",
        "model_rejects_without_transmit"
      ],
      "N02": [
        "fixture_outcome",
        "checksum_fault_preserved",
        "invalid_input_silent",
        "valid_control_recovers",
        "quiet_window_bounded",
        "capture_no_kernel_drops",
        "lab_preconditions",
        "model_rejects_without_transmit"
      ]
    },
    "normalization": [
      "Ethernet padding excluded from IPv4 comparison",
      "Generated response IPv4 identification excluded; actual header checksum must validate",
      "Capture timestamps and simulator virtual times are different clock domains",
      "S04 compares bounded ARP failure semantics: Linux emits ICMP host unreachable; Wyrlex reports arp_timeout without generating that ICMP message. This is a declared model difference.",
      "S04 Linux keeps the peer link up with arp_ignore=8; Wyrlex disables the peer port. Only the no-ARP-answer condition is compared.",
      "N01/N02 enter R1 through Ethernet injection; AF_INET IP_HDRINCL is excluded because Linux can repair IPv4 checksums.",
      "Malformed-input silence is bounded to at least one second and followed by a valid same-path control."
    ],
    "excluded": [
      "Exact ARP retry counts and timing equality",
      "MAC cache aging",
      "wall-clock latency equivalence",
      "loss/jitter distribution equivalence",
      "firmware or vendor conformance",
      "S04 Linux ICMP host-unreachable generation equivalence; Wyrlex models only internal ARP timeout",
      "Administrative-down or physical-link behavior equivalence",
      "Silence after the bounded observation window",
      "Malformed packet forms other than the two specified checksum faults",
      "Unrelated IPv4 IGMP multicast membership reports generated by Linux bridge setup"
    ]
  }
}
